{
  "id": "org.legeos.Files",
  "display_name": "Files",
  "primary_desktop_file_id": "org.legeos.Files.desktop",
  "executable": "/usr/bin/lege-files",
  "aliases": {
    "desktop_file_ids": ["org.legeos.Files.desktop", "com.system76.CosmicFiles.desktop"],
    "wayland_app_ids": ["org.legeos.Files", "com.system76.CosmicFiles"],
    "startup_wm_classes": ["lege-files", "cosmic-files"],
    "flatpak_ids": [],
    "executable_paths": ["/usr/bin/lege-files"]
  },
  "mime_types": ["inode/directory"],
  "resource_class": "Interactive",
  "supports_checkpoint": true
}
