{
  "id": "org.legeos.Viewer",
  "display_name": "Lege Viewer",
  "primary_desktop_file_id": "org.legeos.Viewer.desktop",
  "executable": "/usr/bin/lege-viewer",
  "aliases": {
    "desktop_file_ids": ["org.legeos.Viewer.desktop"],
    "wayland_app_ids": ["org.legeos.Viewer"],
    "startup_wm_classes": ["lege-viewer"],
    "flatpak_ids": [],
    "executable_paths": ["/usr/bin/lege-viewer"]
  },
  "mime_types": ["application/pdf", "image/tiff"],
  "resource_class": "Interactive",
  "supports_checkpoint": true
}
